{
  "schema": "addition.v1",
  "video_id": "hypothesis_testing_0208",
  "addition_id": "0f3c2a9d8b7e4c1aa5d6e7f8091a2b3c",
  "action": "add",
  "figure": {
    "shape": "table",
    "title": "Type I and Type II errors",
    "columns": [
      "Type",
      "Meaning",
      "Symbol"
    ],
    "rows": [
      {
        "cells": [
          "Type I",
          "Rejecting a true null hypothesis",
          "α"
        ],
        "added": [
          false,
          false,
          true
        ],
        "t": 600.0
      },
      {
        "cells": [
          "Type II",
          "Failing to reject a false null hypothesis",
          "β"
        ],
        "added": [
          false,
          false,
          true
        ],
        "t": 620.0
      }
    ]
  },
  "span": [
    540.0,
    650.0
  ],
  "question": "summarise type 1 and type 2 errors as a table",
  "outside": true,
  "model": "openai/gpt-oss-20b",
  "topic_override": null,
  "created_ts": 1793260000000
}
